====================
     07-11-2020
====================

[frameworks/base]
FODCircleView: Let us call show() when mIsBouncer() && !isPinOrPattern() <2 months ago> [86d854ec81f]
by: LuK1337 (priv.luk@gmail.com)
FODCircleView: Show while bouncer is requesting Pattern or PIN <4 months ago> [ea839da2265]
by: TheScarastic (warabhishek@gmail.com)
DozeSensors: only use proximity sensor if supported <3 months ago> [5c0338e67cf]
by: Demon000 (demonsingur@gmail.com)
Revert "base: SystemUI: add separate config for pulse brightness [1/2]" <20 hours ago> [903ce8e905d]
by: Ido Ben-Hur (idoybh2@gmail.com)

[packages/apps/DerpQuest]
DerpQuest: Remove custom doze brightness settings <20 hours ago> [40020a5]
by: Ido Ben-Hur (idoybh2@gmail.com)

[scripts]
scripts: updater: Offer to direct link for OpenDelta <21 hours ago> [5cca7d4]
by: Ido Ben-Hur (idoybh2@gmail.com)

[device/xiaomi/davinci]
davinci: Change Statusbar height back to 35dp <52 minutes ago> [501b6544]
by: DarkDampSquib (andrin.geiger1998@gmail.com)
davinci: Bump required fw to 12.0.1.0 <7 days ago> [26081ea0]
by: DarkDampSquib (andrin.geiger1998@gmail.com)
davinci: Update from Global Stable V12.0.1.0.QFJMIXM <2 weeks ago> [1b11386f]
by: Arian (arian.kulmer@web.de)
davinci: init: Set hardware sku to davinci * Only enable NFC for specific variants if the sku is set. <6 days ago> [e60e00f8]
by: PIPIPIG233666 (pig.priv@gmail.com)
davinci: Add Dolby <8 days ago> [855aaf20]
by: Sonal Singh (sonal.singh.19993@gmail.com)
davinci: Nuke Dirac <5 days ago> [535fff0e]
by: DarkDampSquib (andrin.geiger1998@gmail.com)

[kernel/xiaomi/davinci]
proc: Don't let facebook app run in the background <5 days ago> [9ba8a910ab7d]
by: vantoman (Mustafa.vantom@gmail.com)
Merge branch 'kernel.lnx.4.14.r4-rel' of https://github.com/android-linux-stable/msm-4.14 into VantomKernel-Y <20 hours ago> [fecbd4b01d22]
by: DarkDampSquib (andrin.geiger1998@gmail.com)

[vendor/xiaomi/davinci]
davinci: Update blobs from global miui 12.0.1.0 <20 hours ago> [dcf0c30]
by: DarkDampSquib (andrin.geiger1998@gmail.com)
davinci: Add Moto Dolby blobs * from lake 'QPW30.61-18' <3 months ago> [589703a]
by: trpsl (trpsl755@gmail.com)

[frameworks/base]
FODCircleView: Let us call show() when mIsBouncer() && !isPinOrPattern() <2 months ago> [86d854ec81f]
by: LuK1337 (priv.luk@gmail.com)
FODCircleView: Show while bouncer is requesting Pattern or PIN <4 months ago> [ea839da2265]
by: TheScarastic (warabhishek@gmail.com)
DozeSensors: only use proximity sensor if supported <3 months ago> [5c0338e67cf]
by: Demon000 (demonsingur@gmail.com)
Revert "base: SystemUI: add separate config for pulse brightness [1/2]" <20 hours ago> [903ce8e905d]
by: Ido Ben-Hur (idoybh2@gmail.com)


====================
     07-10-2020
====================

[frameworks/base]
FODCircleView: Update FOD icon position on DreamingStateChanged <6 weeks ago> [7b62b4f26a8]
by: Ashwin R C (ashwin2001achu@gmail.com)

[packages/apps/Contacts]
Contacts: Make the launch screen follow the system theme <4 weeks ago> [9c66735e0]
by: Scott Warner (Tortel1210@gmail.com)

[packages/apps/Dialer]
Automatic translation import <2 days ago> [ddd6a529f]
by: Akhil Narang (akhilnarang.1999@gmail.com)

[packages/apps/Messaging]
Automatic translation import <2 days ago> [42b2e5e]
by: Akhil Narang (akhilnarang.1999@gmail.com)

[vendor/gapps]
Revert "gapps: Drop overlays" <35 hours ago> [62208b8]
by: Ido Ben-Hur (idoybh2@gmail.com)

[vendor/pixelstyle]
pixelstyle: Add Linotte font [2/2] <7 days ago> [1501a8f]
by: Ido Ben-Hur (idoybh2@gmail.com)
pixelstyle: Add EvolveSans font [2/2] <7 days ago> [460c820]
by: Ido Ben-Hur (idoybh2@gmail.com)
pixelstyle: Don't build google specific overlays for VANILLA <8 days ago> [dd02c41]
by: Ido Ben-Hur (idoybh2@gmail.com)
[SQUASH] Remove OPScreenRecorder <9 days ago> [eac5390]
by: Ido Ben-Hur (idoybh2@gmail.com)

[kernel/xiaomi/davinci]
Merge 4.14.188 into kernel.lnx.4.14.r4-rel <33 hours ago> [b9165d3a986a]
by: Nathan Chancellor (natechancellor@gmail.com)

[frameworks/base]
FODCircleView: Update FOD icon position on DreamingStateChanged <6 weeks ago> [7b62b4f26a8]
by: Ashwin R C (ashwin2001achu@gmail.com)


====================
     07-09-2020
====================

[frameworks/base]
base: QS: Make sure we don't show an empty row <3 days ago> [9fa8f78a0a0]
by: Ido Ben-Hur (idoybh2@gmail.com)

[packages/apps/Dialer]
Dialer: Use a DayNight launch theme <2 weeks ago> [f4b2a5430]
by: Scott Warner (Tortel1210@gmail.com)

[packages/apps/Messaging]
Messaging: Use a DayNight launch theme <2 weeks ago> [f6685e8]
by: Scott Warner (Tortel1210@gmail.com)

[system/core]
adb: Look for shell executable in alternate places <2 years, 11 months ago> [7bd5bdb2b]
by: Tom Marshall (tdm.code@gmail.com)

[packages/apps/OpenDelta]
OpenDelta: Add a null check for info image visibility <3 days ago> [fd77b58]
by: Ido Ben-Hur (idoybh2@gmail.com)

[kernel/xiaomi/davinci]
Linux 4.14.188 <2 days ago> [56dfe6252c68]
by: Greg Kroah-Hartman (gregkh@linuxfoundation.org)
efi: Make it possible to disable efivar_ssdt entirely <4 weeks ago> [d08e8347b707]
by: Peter Jones (pjones@redhat.com)
dm zoned: assign max_io_len correctly <4 weeks ago> [89306f5ea312]
by: Hou Tao (houtao1@huawei.com)
irqchip/gic: Atomically update affinity <3 weeks ago> [fa1c518dfe21]
by: Marc Zyngier (maz@kernel.org)
MIPS: Add missing EHB in mtc0 -> mfc0 sequence for DSPen <9 days ago> [ef2c83786b0b]
by: Hauke Mehrtens (hauke@hauke-m.de)
cifs: Fix the target file was deleted when rename failed. <12 days ago> [fb28917db916]
by: Zhang Xiaoxu (zhangxiaoxu5@huawei.com)
SMB3: Honor persistent/resilient handle flags for multiuser mounts <2 weeks ago> [9db66da3575f]
by: Paul Aurich (paul@darkrain42.org)
SMB3: Honor 'seal' flag for multiuser mounts <2 weeks ago> [0e1839bb7a5b]
by: Paul Aurich (paul@darkrain42.org)
Revert "ALSA: usb-audio: Improve frames size computation" <4 days ago> [282aba56713b]
by: Greg Kroah-Hartman (gregkh@linuxfoundation.org)
nfsd: apply umask on fs without ACL support <4 weeks ago> [15fefb108c7a]
by: J. Bruce Fields (bfields@redhat.com)
i2c: algo-pca: Add 0x78 as SCL stuck low status for PCA9665 <10 days ago> [97071dcd17c1]
by: Chris Packham (chris.packham@alliedtelesis.co.nz)
virtio-blk: free vblk-vqs in error path of virtblk_probe() <4 weeks ago> [8040aa48727e]
by: Hou Tao (houtao1@huawei.com)
drm: sun4i: hdmi: Remove extra HPD polling <12 days ago> [7e3bde4e063c]
by: Chen-Yu Tsai (wens@csie.org)
hwmon: (acpi_power_meter) Fix potential memory leak in acpi_power_meter_add() <2 weeks ago> [91437c8300cf]
by: Misono Tomohiro (misono.tomohiro@jp.fujitsu.com)
hwmon: (max6697) Make sure the OVERT mask is set correctly <3 weeks ago> [a5275f24da11]
by: Chu Lin (linchuyuan@google.com)
cxgb4: parse TC-U32 key values and masks natively <3 weeks ago> [b728e1f0bfdc]
by: Rahul Lakkireddy (rahul.lakkireddy@chelsio.com)
cxgb4: use unaligned conversion for fetching timestamp <3 weeks ago> [f9e9f6c7331f]
by: Rahul Lakkireddy (rahul.lakkireddy@chelsio.com)
crypto: af_alg - fix use-after-free in af_alg_accept() due to bh_lock_sock() <5 weeks ago> [687ca6afdae1]
by: Herbert Xu (herbert@gondor.apana.org.au)
kgdb: Avoid suspicious RCU usage warning <6 weeks ago> [ac31ef00ad96]
by: Douglas Anderson (dianders@chromium.org)
usb: usbtest: fix missing kfree(dev->buf) in usbtest_disconnect <4 weeks ago> [4336374bc222]
by: Zqiang (qiang.zhang@windriver.com)
mm/slub: fix stack overruns with SLUB_STATS <6 weeks ago> [88451e4b5479]
by: Qian Cai (cai@lca.pw)
mm/slub.c: fix corrupted freechain in deactivate_slab() <6 weeks ago> [00d2b1efa0bb]
by: Dongli Zhang (dongli.zhang@oracle.com)
usbnet: smsc95xx: Fix use-after-free after removal <3 weeks ago> [01a425d081be]
by: Tuomas Tynkkynen (tuomas.tynkkynen@iki.fi)
EDAC/amd64: Read back the scrub rate PCI register on F15h <3 weeks ago> [3ecfc0fdaea1]
by: Borislav Petkov (bp@suse.de)
mm: fix swap cache node allocation mask <2 weeks ago> [eba151dc93e6]
by: Hugh Dickins (hughd@google.com)
btrfs: fix data block group relocation failure due to concurrent scrub <5 weeks ago> [6d87c029bbf0]
by: Filipe Manana (fdmanana@suse.com)
btrfs: cow_file_range() num_bytes and disk_num_bytes are same <2 years, 5 months ago> [e3c693315709]
by: Anand Jain (Anand.Jain@oracle.com)
btrfs: fix a block group ref counter leak after failure to remove block group <6 weeks ago> [b74639caf403]
by: Filipe Manana (fdmanana@suse.com)

[frameworks/base]
base: QS: Make sure we don't show an empty row <3 days ago> [9fa8f78a0a0]
by: Ido Ben-Hur (idoybh2@gmail.com)


====================
     07-08-2020
====================

[frameworks/av]
Add persist.sys.phh.disable_a2dp_offload property to force a2dp offload <7 weeks ago> [c7fd34fd9]
by: Pierre-Hugues Husson (phh@phh.me)

[frameworks/base]
base: Fix freeform window moving/resizing doesn't work <9 weeks ago> [607c5b2efc6]
by: utzcoz (utzcoz@gmail.com)

[system/bt]
Add persist.sys.phh.disable_a2dp_offload property to force a2dp offload <7 weeks ago> [cd0a289c3]
by: Pierre-Hugues Husson (phh@phh.me)

[vendor/ANXCamera]
Update ANX to V185 <7 days ago> [9cf4272]
by: DarkDampSquib (andrin.geiger1998@gmail.com)

[frameworks/base]
base: Fix freeform window moving/resizing doesn't work <9 weeks ago> [607c5b2efc6]
by: utzcoz (utzcoz@gmail.com)


====================
     07-07-2020
====================

[manifest]
Merge tag 'android-10.0.0_r40' into ten <4 days ago> [675dc06]
by: Ido Ben-Hur (idoybh2@gmail.com)
Manifest for Android 10.0.0 Release 40 <5 days ago> [5383244]
by: The Android Open Source Project (initial-contribution@android.com)

[build/make]
Merge tag 'android-10.0.0_r40' into HEAD <5 days ago> [bf43f35c6]
by: Ido Ben-Hur (idoybh2@gmail.com)

[frameworks/base]
VolumeDialog: Launch Q expanded volume panel on arrow longpress <2 weeks ago> [06203df745c]
by: Adhitya Mohan (me@adhityamohan.in)

[frameworks/native]
Revert "surfaceflinger: Merge caf changes" <4 weeks ago> [929872252]
by: DarkDampSquib (andrin.geiger1998@gmail.com)
Revert "SurfaceFlinger: Exclude CAF extensions from non-QC devices" <4 weeks ago> [7000ca3d1]
by: DarkDampSquib (andrin.geiger1998@gmail.com)
Revert "sf: Fix issue with dequeueBuffer when multiple display present" <4 weeks ago> [33a0d5456]
by: DarkDampSquib (andrin.geiger1998@gmail.com)
Revert "DO NOT MERGE: SF: fix SurfaceFlinger freeze" <4 weeks ago> [8775fd211]
by: DarkDampSquib (andrin.geiger1998@gmail.com)
Revert "sf: avoid assumption remote binder is local" <4 weeks ago> [a6759ff88]
by: DarkDampSquib (andrin.geiger1998@gmail.com)
Revert "commonsys-intf: display: Add extension interfaces" <4 weeks ago> [711895629]
by: DarkDampSquib (andrin.geiger1998@gmail.com)
Revert "commonsys-intf: display: Add frame extn interface." <4 weeks ago> [e46a0aa91]
by: DarkDampSquib (andrin.geiger1998@gmail.com)
Merge tag 'android-10.0.0_r40' into staging/ten-android-10.0.0_r40 <5 days ago> [1f2c99574]
by: Ido Ben-Hur (idoybh2@gmail.com)

[packages/apps/Matlog]
Matlog: Add a simple QS tile <9 days ago> [7b01e8a]
by: Ido Ben-Hur (idoybh2@gmail.com)

[packages/services/Telephony]
Merge tag 'android-10.0.0_r40' into staging/ten-android-10.0.0_r40 <5 days ago> [62ecdb1ed]
by: Ido Ben-Hur (idoybh2@gmail.com)

[scripts]
scripts: updater: Use git remote to fetch changes <4 days ago> [c9ccbdf]
by: Ido Ben-Hur (idoybh2@gmail.com)
scripts: updater: Push info.sh in a separate commit <2 weeks ago> [b861437]
by: Ido Ben-Hur (idoybh2@gmail.com)

[frameworks/base]
VolumeDialog: Launch Q expanded volume panel on arrow longpress <2 weeks ago> [06203df745c]
by: Adhitya Mohan (me@adhityamohan.in)


====================
     07-06-2020
====================

[frameworks/base]
screenrecord: UI Improvements <9 days ago> [1fcad7eecee]
by: Ido Ben-Hur (idoybh2@gmail.com)
base: Do not condition VoWiFi icon change on calls <7 days ago> [f970e6da9d9]
by: Ido Ben-Hur (idoybh2@gmail.com)
SystemUI: Update RU translation (#31) <7 days ago> [1dfb00e0f39]
by: Northn (57762732+Northn@users.noreply.github.com)
base: Add Linotte font [1/2] <7 days ago> [4f92d3fb898]
by: Ido Ben-Hur (idoybh2@gmail.com)
base: Use only 18px size icon for notification count <7 days ago> [bcc6de52d67]
by: Ido Ben-Hur (idoybh2@gmail.com)
base: overlays: Add EvolveSans font [1/2] <7 days ago> [cff5a183da4]
by: Ido Ben-Hur (idoybh2@gmail.com)
Show infinity for large notification counts <3 years, 5 months ago> [d29155827be]
by: d34d (clark@cyngn.com)
SystemUI: Forward-port notification counters [1/2] <6 years ago> [07ea6f180e4]
by: Steve Kondik (steve@cyngn.com)
SystemUI: Add USB Tether tile <5 years ago> [a3fcc8c8d98]
by: BestPig (bestpig82@gmail.com)
Revert "base: SystemUI: add OmniRecord based qs tile" <9 days ago> [6fa6c4bf209]
by: Ido Ben-Hur (idoybh2@gmail.com)
SystemUI: PowerMenu: Use AOSP recorder for screen record button <9 days ago> [1cb7e9a8f76]
by: Ido Ben-Hur (idoybh2@gmail.com)

[packages/apps/DeskClock]
DeskClock: Remove notification sound from firing and snoozing channels <4 weeks ago> [22ec01749]
by: Michael W (baddaemon87@gmail.com)
DeskClock: Replace ViewPager with manual fragment handling <4 weeks ago> [f71fd84d6]
by: Michael W (baddaemon87@gmail.com)

[packages/apps/Settings]
Settings: Randomize DerpQuest's summary <4 weeks ago> [0cc092a58b]
by: Ido Ben-Hur (idoybh2@gmail.com)
Settings: Update RU translation (#15,#16) <4 weeks ago> [39f3f0affa]
by: RunningMango (36758157+RunningMango@users.noreply.github.com)

[packages/apps/OpenDelta]
Merge remote-tracking branch 'omni/android-10' into ten <6 days ago> [b0d6c48]
by: Ido Ben-Hur (idoybh2@gmail.com)

[frameworks/base]
screenrecord: UI Improvements <9 days ago> [1fcad7eecee]
by: Ido Ben-Hur (idoybh2@gmail.com)
base: Do not condition VoWiFi icon change on calls <7 days ago> [f970e6da9d9]
by: Ido Ben-Hur (idoybh2@gmail.com)
SystemUI: Update RU translation (#31) <7 days ago> [1dfb00e0f39]
by: Northn (57762732+Northn@users.noreply.github.com)
base: Add Linotte font [1/2] <7 days ago> [4f92d3fb898]
by: Ido Ben-Hur (idoybh2@gmail.com)
base: Use only 18px size icon for notification count <7 days ago> [bcc6de52d67]
by: Ido Ben-Hur (idoybh2@gmail.com)
base: overlays: Add EvolveSans font [1/2] <7 days ago> [cff5a183da4]
by: Ido Ben-Hur (idoybh2@gmail.com)
Show infinity for large notification counts <3 years, 5 months ago> [d29155827be]
by: d34d (clark@cyngn.com)
SystemUI: Forward-port notification counters [1/2] <6 years ago> [07ea6f180e4]
by: Steve Kondik (steve@cyngn.com)
SystemUI: Add USB Tether tile <5 years ago> [a3fcc8c8d98]
by: BestPig (bestpig82@gmail.com)
Revert "base: SystemUI: add OmniRecord based qs tile" <9 days ago> [6fa6c4bf209]
by: Ido Ben-Hur (idoybh2@gmail.com)
SystemUI: PowerMenu: Use AOSP recorder for screen record button <9 days ago> [1cb7e9a8f76]
by: Ido Ben-Hur (idoybh2@gmail.com)


====================
     07-05-2020
====================

[packages/apps/DerpQuest]
DerpQuest: Add a switch for notification counters [2/2] <7 days ago> [92630bf]
by: Ido Ben-Hur (idoybh2@gmail.com)
DerpQuest: Fixed typos in strings (#69) <9 days ago> [2f514b2]
by: Northn (57762732+Northn@users.noreply.github.com)
DerpQuest: Update RU translation (#68,#70,#71) <13 days ago> [7bed9b1]
by: Northn (57762732+Northn@users.noreply.github.com)

[prebuilts/clang/host/linux-x86/clang-proton]
Update to 20200704 build <7 days ago> [ce095cc]
by: Danny (danny@kdrag0n.dev)


